"question,expected_answer"
"What type of programming language is Python?, ""Python is an easy to learn, powerful programming language."" [cite: 2210]"
"What are some of Python's features?, ""Efficient high-level data structures and a simple but effective approach to object-oriented programming."" [cite: 2210]"
"What makes Python an ideal language for scripting?, ""Python’s elegant syntax and dynamic typing, together with its interpreted nature."" [cite: 2211]"
"Is the Python interpreter freely available?, ""Yes, the Python interpreter and the extensive standard library are freely available in source or binary form for all major platforms from the Python web site, https://www.python.org/, and may be freely distributed."" [cite: 2212]"
"Can the Python interpreter be extended?, ""Yes, the Python interpreter is easily extended with new functions and data types implemented in C or C++ (or other languages callable from C)."" [cite: 2214]"
"For what type of applications is Python suitable?, ""Python is also suitable as an extension language for customizable applications."" [cite: 2215]"
"What does this tutorial introduce?, ""This tutorial introduces the reader informally to the basic concepts and features of the Python language and system."" [cite: 2216]"
"Is hands-on experience necessary to use this tutorial?, ""It helps to have a Python interpreter handy for hands-on experience, but all examples are self-contained, so the tutorial can be read off-line as well."" [cite: 2217]"
"Where can you find a description of standard objects and modules?, ""The Python Standard Library."" [cite: 2218]"
"Where can you find a more formal definition of the language?, ""The Python Language Reference."" [cite: 2218]"
"What should you read to write extensions in C or C++?, ""Extending and Embedding the Python Interpreter and Python/C API Reference Manual."" [cite: 2219]"
"Does this tutorial cover every single feature of Python?, ""No, this tutorial does not attempt to be comprehensive and cover every single feature, or even every commonly used feature."" [cite: 2220]"
"What is the purpose of this tutorial?, ""Instead, it introduces many of Python’s most noteworthy features, and will give you a good idea of the language’s flavor and style."" [cite: 2221]"
"What will you be able to do after reading this tutorial?, ""After reading it, you will be able to read and write Python modules and programs, and you will be ready to learn more about the various Python library modules described in The Python Standard Library."" [cite: 2222]"
"What else is worth going through?, ""The Glossary is also worth going through."" [cite: 2223]"
"What type of task can you automate with Python?, ""You may wish to perform a search-and-replace over a large number of text files, or rename and rearrange a bunch of photo files in a complicated way. Perhaps you’d like to write a small custom database, or a specialized GUI application, or a simple game."" [cite: 2224, 2225]"
"If you are a professional software developer, what problem might you have with C/C++/Java libraries?, ""You may have to work with several C/C++/Java libraries but find the usual write/compile/test/re-compile cycle is too slow."" [cite: 2226, 2227]"
"What can Python be used for in terms of testing?, ""Perhaps you’re writing a test suite for such a library and find writing the testing code a tedious task."" [cite: 2227, 2228]"
"When might you use Python as an extension language?, ""Or maybe you’ve written a program that could use an extension language, and you don’t want to design and implement a whole new language for your application."" [cite: 2228, 2229]"
"What are shell scripts good at?, ""Shell scripts are best at moving around files and changing text data, not well-suited for GUI applications or games."" [cite: 2229, 2230]"
"What are some drawbacks of using C/C++/Java?, ""It can take a lot of development time to get even a first-draft program."" [cite: 2230, 2231]"
"Is Python available on multiple operating systems?, ""Yes, Python is available on Windows, macOS, and Unix operating systems."" [cite: 2231, 2232]"
"Does Python offer more structure than shell scripts?, ""Yes, Python is simple to use, but it is a real programming language, offering much more structure and support for large programs than shell scripts or batch files can offer."" [cite: 2232, 2233]"
"How does Python compare to C in terms of error checking?, ""On the other hand, Python also offers much more error checking than C."" [cite: 2233, 2234]"
"What kind of data types does Python have?, ""Being a very-high-level language, it has high-level data types built in, such as flexible arrays and dictionaries."" [cite: 2233, 2234]"
"Is Python applicable to a large problem domain?, ""Because of its more general data types Python is applicable to a much larger problem domain than Awk or even Perl, yet many things are at least as easy in Python as in those languages."" [cite: 2234, 2235]"
"Can you split your program into modules in Python?, ""Python allows you to split your program into modules that can be reused in other Python programs."" [cite: 2235, 2236]"
"What does Python come with?, ""It comes with a large collection of standard modules that you can use as the basis of your programs — or as examples to start learning to program in Python."" [cite: 2236, 2237]"
"What do some of the modules provide?, ""Some of these modules provide things like file I/O, system calls, sockets, and even interfaces to graphical user interface toolkits like Tk."" [cite: 2237, 2238]"
"What is an advantage of Python being an interpreted language?, ""Python is an interpreted language, which can save you considerable time during program development because no compilation and linking is necessary."" [cite: 2238, 2239]"
"How can the interpreter be used?, ""The interpreter can be used interactively, which makes it easy to experiment with features of the language, to write throw-away programs, or to test functions during bottom-up program development. It is also a handy desk calculator."" [cite: 2239, 2240]"
"What does Python enable programs to be?, ""Python enables programs to be written compactly and readably."" [cite: 2240, 2241]"
"Why are Python programs typically shorter?, ""The high-level data types allow you to express complex operations in a single statement; statement grouping is done by indentation instead of beginning and ending brackets; no variable or argument declarations are necessary."" [cite: 2241, 2242, 2243]"
"What does it mean for Python to be extensible?, ""Python is extensible: if you know how to program in C it is easy to add a new built-in function or module to the interpreter, either to perform critical operations at maximum speed, or to link Python programs to libraries that may only be available in binary form (such as a vendor-specific graphics library)."" [cite: 2243, 2244]"
"What can you do once you are really hooked on Python?, ""Once you are really hooked, you can link the Python interpreter into an application written in C and use it as an extension or command language for that application."" [cite: 2244, 2245]"
"Where did the name Python come from?, ""By the way, the language is named after the BBC show “Monty Python’s Flying Circus” and has nothing to do with reptiles."" [cite: 2245, 2246]"
"What is encouraged in Python documentation?, ""Making references to Monty Python skits in documentation is not only allowed, it is encouraged!"" [cite: 2247, 2248]"
"What is the best way to learn a language?, ""Since the best way to learn a language is to use it, the tutorial invites you to play with the Python interpreter as you read."" [cite: 2248, 2249]"
"What does the next chapter explain?, ""In the next chapter, the mechanics of using the interpreter are explained."" [cite: 2249, 2250]"
"What kind of information is in the next chapter?, ""This is rather mundane information, but essential for trying out the examples shown later."" [cite: 2250, 2251]"
"What does the rest of the tutorial introduce?, ""The rest of the tutorial introduces various features of the Python language and system through examples, beginning with simple expressions, statements and data types, through functions and modules, and finally touching upon advanced concepts like exceptions and user-defined classes."" [cite: 2251, 2252]"
"Where is the Python interpreter usually installed on Unix machines?, ""The Python interpreter is usually installed as /usr/local/bin/python3.13 on those machines where it is available."" [cite: 2252, 2253, 2254]"
"How can you start the Python interpreter on Unix?, ""Putting /usr/local/bin in your Unix shell’s search path makes it possible to start it by typing the command: to the shell. [1] Since the choice of the directory where the interpreter lives is an installation option, other places are possible; check with your local Python guru or system administrator. (E.g., /usr/local/python is a popular alternative location.)"" [cite: 2252, 2253, 2254]"
"How can you start the Python interpreter on Windows machines?, ""On Windows machines where you have installed Python from the Microsoft Store, the python3.13 command will be available. If you have the py.exe launcher installed, you can use the py command."" [cite: 2254, 2255, 2256, 2257]"
"How do you exit the interpreter?, ""Typing an end-of-file character (Control-D on Unix, Control-Z on Windows) at the primary prompt causes the interpreter to exit with a zero exit status. If that doesn’t work, you can exit the interpreter by typing the following command: quit()."" [cite: 2254, 2255, 2256, 2257]"
"What line-editing features does the interpreter have?, ""The interpreter’s line-editing features include interactive editing, history substitution and code completion on systems that support the GNU Readline library."" [cite: 2258, 2259, 2260, 2261, 2262]"
"How can you check if command line editing is supported?, ""Perhaps the quickest check to see whether command line editing is supported is typing Control-P to the first Python prompt you get. If it beeps, you have command line editing; see Appendix Interactive Input Editing and History Substitution for an introduction to the keys. If nothing appears to happen, or if ^P is echoed, command line editing isn’t available; you’ll only be able to use backspace to remove characters from the current line."" [cite: 2258, 2259, 2260, 2261, 2262]"
"How does the interpreter operate when called with standard input connected to a tty device?, ""The interpreter operates somewhat like the Unix shell: when called with standard input connected to a tty device, it reads and executes commands interactively."" [cite: 2263, 2264, 2265, 2266, 2267]"
"How does the interpreter operate when called with a file name argument?, ""When called with a file name argument or with a file as standard input, it reads and executes a script from that file."" [cite: 2263, 2264, 2265, 2266, 2267]"
"What is another way to start the interpreter?, ""A second way of starting the interpreter is python -c command [arg] ..., which executes the statement(s) in command, analogous to the shell’s -c option."" [cite: 2265, 2266, 2267]"
"What should you do if Python statements contain spaces or other characters that are special to the shell?, ""Since Python statements often contain spaces or other characters that are special to the shell, it is usually advised to quote command in its entirety."" [cite: 2266, 2267]"
"How can some Python modules be invoked?, ""Some Python modules are also useful as scripts. These can be invoked using python -m module [arg] ..., which executes the source file formodule as if you had spelled out its full name on the command line."" [cite: 2267, 2268, 2269]"
"What is useful to do when a script file is used?, ""When a script file is used, it is sometimes useful to be able to run the script and enter interactive mode afterwards."" [cite: 2268, 2269]"
"How can you run a script and enter interactive mode afterward?, ""This can be done by passing -i before the script. All command line options are described in Command line and environment."" [cite: 2269, 2270, 2271, 2272, 2273, 2274, 2275]"
"What happens to the script name and additional arguments when known to the interpreter?, ""When known to the interpreter, the script name and additional arguments thereafter are turned into a list of strings and assigned to the argv variable in the sys module."" [cite: 2270, 2271, 2272, 2273, 2274, 2275]"
"How can you access the list of strings?, ""You can access this list by executing import sys."" [cite: 2271, 2272, 2273, 2274, 2275]"
"What is the length of the list if no script and no arguments are given?, ""The length of the list is at least one; when no script and no arguments are given, sys.argv[0] is an empty string."" [cite: 2271, 2272, 2273, 2274, 2275]"
"What is sys.argv[0] set to when the script name is given as '-'?, ""When the script name is given as '-', (meaning standard input), sys.argv[0] is set to '-'."" [cite: 2273, 2274, 2275]"
"What is sys.argv[0] set to when -c command is used?, ""When -c command is used, sys.argv[0] is set to '-c'."" [cite: 2273, 2274, 2275]"
"What is sys.argv[0] set to when -m module is used?, ""When -m module is used, sys.argv[0] is set to the full name of the located module."" [cite: 2273, 2274, 2275]"
"What happens to options found after -c command or -m module?, ""Options found after -c command or -m module are not consumed by the Python interpreter’s option processing but left in sys.argv for the command or module to handle."" [cite: 2276, 2277, 2278, 2279]"
"What mode is the interpreter in when commands are read from a tty?, ""When commands are read from a tty, the interpreter is said to be in interactive mode."" [cite: 2276, 2277, 2278, 2279]"
"What does the interpreter prompt for in interactive mode?, ""In this mode it prompts for the next command with the primary prompt, usually three greater-than signs (>>>); for continuation lines it prompts with the secondary prompt, by default three dots (...)."" [cite: 2279, 2280]"
"What does the interpreter print before the first prompt?, ""The interpreter prints a welcome message stating its version number and a copyright notice before printing the first prompt:"" [cite: 2279, 2280]"
"When are continuation lines needed?, ""Continuation lines are needed when entering a multi-line construct. As an example, take a look at this if statement:"" [cite: 2281, 2282, 2283]"
"What is the default encoding for Python source files?, ""By default, Python source files are treated as encoded in UTF-8."" [cite: 2281, 2282, 2283]"
"What is the encoding used for Python source files by default?, ""By default, Python source files are treated as encoded in UTF-8."""
"What is the most commonly used encoding for general-purpose text?, ""UTF-8 is the most commonly used encoding for general-purpose text; many other encodings that Python supports can also be used."""
"What is an alternate encoding declaration?, ""An alternative encoding declaration is needed only if a different encoding than the default UTF-8 is going to be used."""
"If the first line of the source file is not a shebang line, how should an encoding declaration be placed?, ""To declare an encoding other than the default encoding, a special comment line should be added as the first line of the file. The syntax is shown in the next example:"""
"If the first line of the source file is a shebang line, how should an encoding declaration be placed?, ""If the first line of the file is a shebang line, the encoding declaration should be placed as the second line."""
"What is the purpose of an encoding declaration?, ""More precisely, the first or second line must match the regular expression coding[:=]\s*([-\w.]+)."""
"Can you use a coding declaration to set the character encoding for unicode literals?, ""No, you can not use the coding declaration to set the character encoding used for Unicode literals. The encoding used in such literals is always UTF-8."""
"What is the advantage of using the Python interpreter interactively?, ""One of the big advantages of Python is the interpreter can be used interactively, which means you can enter lines of Python code and immediately see the results."""
"How do you start the interactive interpreter?, ""You can start the interactive interpreter by simply typing python or python3 at your terminal prompt."""
"What is the primary prompt in the interactive interpreter?, ""When you start the interactive interpreter, you’ll see a greeting message followed by a prompt, three greater-than signs (>>> )."""
"How do you type a multi-line statement in the interactive interpreter?, ""To type a multi-line statement, they have to continue on subsequent lines. As an example, take a look at this if statement:"""
"What is the secondary prompt for continuation lines in the interactive interpreter?, ""When more lines are needed to continue the multi-line construct, the interpreter issues the secondary prompt, by default three dots (...)."""
"How do you leave the interactive interpreter?, ""To leave the interactive interpreter, you can type quit() at the prompt:"""
"What is the behavior of the interactive interpreter regarding errors?, ""When an error occurs, the interpreter prints an error message and a stack trace. In interactive mode, it then returns to the primary prompt; when input came from a file, the program exits with a nonzero exit status after printing the stack trace."""
"What type of errors are catchable in a try statement?, ""All errors are exceptions in Python. All exceptions are catchable by the try statement."""
"What happens to the last evaluated expression in the interactive interpreter?, ""In interactive mode, the last printed expression value is assigned to the variable _."""
"Can the variable '_' be used in subsequent interactive interpreter sessions?, ""This variable _ should be treated as read-only by the user. Don’t explicitly assign a value to it — you would mask the built-in variable with a similarly named local variable with that behavior."""
"What happens to the variable '_' when a value is not printed?, ""Apart from that, its purpose is to assist the interactive interpreter user, so it is fine to use it for other purposes. When not in interactive mode, _ has no special meaning and is still defined but is not automatically assigned to."""
"How are Python source files named?, ""Python source files are treated as normal text files and can be created or edited with any text editor. Python source files typically use .py as the file extension."""
"What is a module in Python?, ""To make a runnable script, Python requires that the file be saved with the .py extension. If a filename is something.py, then by writing import something, you will be able to refer to the functions, variables, and classes inside the old filename."""
"How can you make a Python script executable on Unix-like systems?, ""On Unix-like systems, the Python script can be made directly executable, like a shell script, by putting the line #!/usr/bin/env python3.13 (assuming that the interpreter is on the user’s PATH) at the beginning of the script and setting the executable mode of the file using the chmod command."""
"What is a shebang line?, ""The #!/usr/bin/env python3.13 line is known as the shebang line."""
"What does the shebang line tell the operating system?, ""It tells the operating system to run the script using the interpreter located in that specific path."""
"How is the encoding of a Python source file handled when a shebang line is present?, ""Note that the #!/usr/bin/env python3.13 line has no special meaning in Python’s syntax. The line must be the first line in the script. The default encoding of Python source files is UTF-8."""
"What can you do with modules?, ""Executable code for a module is executed when the module is first imported, and can only be run once per session."""
"What is a module's namespace?, ""Each module has its own namespace, which is effectively a named scope for the variables defined in the module. In modules, you can refer to your top-level variables as global variables."""
"How can users of a module use global variables?, ""Users of a module can use global names by writing module_name.variable_name."""
"Can modules import other modules?, ""Modules can import other modules. It is customary but not required to place all import statements at the beginning of a module (or script, for that matter)."""
"What are the different ways to import module contents?, ""There are a few different ways to import module contents."""
"How can you import a module itself?, ""A module name can be imported directly:"""
"How can you access the module's namespace after importing the module itself?, ""This makes the module name spam available, and permits the user to refer to all names defined within the module using the module name as a prefix:"""
"How can you import specific names from a module?, ""A different variant of the import statement imports names from a module directly into the importing module’s symbol table:"""
"How can you import all names that a module defines?, ""This imports all names except those beginning with an underscore (_). Most programmers do not use this facility since it introduces an unknown set of names into the interpreter, possibly hiding some things you already have defined. Note that in general practice wild card imports should be discouraged."""
"How can you rename a module's name?, ""For every imported item you can assign a different name:"""
"Can you rename a module itself?, ""This essentially renames the module spam, and can be used when you want to use parts of modules by the same name — but you want to control which one gets used."""
"What happens each name is assigned to a value?, ""For instance, in a plain assignment like x = value, the name x is bound to refer to the given value."""
"How can you delete a name binding?, ""The same is true for function and class definitions: they also bind a name in the namespace. It is possible to explicitly delete a binding using the del statement."""
"What happens when you delete a name?, ""Deleting a name removes the binding of that name from the namespace it belongs to. If the name was defined in an outer scope (e.g. a global variable in a function), it will still be accessible after deleting it in the inner scope."""
"What happens if you delete a name before it has been defined?, ""Trying to use a name before it is assigned to will raise a NameError exception."""
"What is the scope of a name?, ""The scope defines the visibility of a name within a program."""
"What are the different scopes in Python?, ""If a local variable is defined in a block, its scope extends to the entire block. If a variable is defined in a function definition, its scope extends to the entire function. If a class variable is defined in a class definition, its scope is limited to the class definition. If a module variable is defined in the main body of a module file, its scope extends to the entire module file (including imports)."""
"When can scopes be nested?, ""Scopes can be nested. If one function calls another, a new scope is created for the called function. If a block is nested in another block, a new scope is created for the nested block, and so on."""
"What is the global scope?, ""The global scope for a script is the module scope of the module within which it is defined. Function definitions in a module will create a nested scope within the global scope."""
"What happens when a name is used in a scope?, ""When a name is used in a scope, it is resolved using the nearest enclosing scope. If that scope does not contain the name, it is searched in the next enclosing scope, and so on."""
"What happens if a name is not found in any scope?, ""If the name is not found in any scope, a NameError exception is raised."""
"What happens if a name is assigned to in a scope?, ""If a name is assigned to in a scope, it is always created or re-bound in that scope. It is never assigned to a name in an outer scope."""
"How can you indicate that a variable is in the global scope?, ""If a variable is to be assigned to in the nearest enclosing scope, it has to be explicitly declared as nonlocal. Similarly, if a variable is to be assigned to in the global scope, it has to be declared as global."""
"What is the scope of names inside class definitions?, ""The scope of names inside class definitions is limited to the class block. Method scopes are always nested in class scopes."""
"What happens when a class definition places another class definition within its body?, ""If a class definition places another class definition within its body, the nested class’s scope is nested in the enclosing class’s scope."""
"What is the difference between global and nonlocal variables?, ""Global variables are variables defined and declared in the main body of the script. They are available throughout the lifetime of the script and can be accessed inside any function. Nonlocal variables are used in nested functions whose scope is not present in the global scope."""
"What is the purpose of the global statement?, ""The global statement is a declaration which holds for the entire current code block. It means that the listed identifiers are to be interpreted as globals."""
"What is the purpose of the nonlocal statement?, ""The nonlocal statement causes the corresponding identifiers to refer to previously bound variables in the nearest enclosing scope excluding globals."""
"What happens when you use a nonlocal variable without a matching outer variable?, ""When the use of a nonlocal name is not matched to a pre-existing binding in an enclosing scope a SyntaxError is raised."""
