"question,expected_answer"
"What are generator expressions?, ""Generator expressions provide a more convenient yet even more compact way to create iterator objects."""
"What is the purpose of generator functions?, ""A function which has a yield statement is compiled as a generator function. When a generator function is called, it returns an iterator known as a generator iterator, or more commonly, a generator. The function body is executed by calling the generator’s next() method repeatedly until it raises StopIteration. Once they do, the generator’s job is done and it will never yield another value."""
"What happens when a generator function is called?, ""When a generator function is called, it returns an iterator known as a generator iterator, or more commonly, a generator."""
"How is the function body of a generator executed?, ""The function body is executed by calling the generator’s next() method repeatedly until it raises StopIteration. Once they do, the generator’s job is done and it will never yield another value."""
"What happens when a yield statement is encountered in a generator function?, ""When a yield statement is encountered, the state of the generator is frozen, and the value of expression_list is returned to the caller of next(). “Frozen” means that all local state is retained, including the current bindings to local variables, the instruction pointer, the pending try-statements, and the pending finally-clauses."""
"What is a context manager?, ""A context manager is an object that defines the runtime context to be established when executing a with statement. The context manager handles the entry into, and the exit from, the desired runtime context for the execution of the block of code within the with statement."""
"What are the methods that a context manager must implement?, ""Context managers are typically used to save and restore various kinds of global state, locking and unlocking resources, closing opened files, etc. Context managers are most often used in conjunction with the with statement, but can also be used by directly invoking their methods. Typical uses of context managers include wrapping the execution of a block of code in some kind of setup or cleanup action. The methods that a context manager needs to implement are: __enter__(), __exit__()"""
"What does the __enter__() method do?, ""Enter the runtime context and return either this object or another object related to the runtime context. If any exceptions occur when entering the runtime context, they must be propagated up by the context manager. This method should return the value that is to be assigned to the target, if any, in the as clause of the with statement."""
"What does the __exit__() method do?, ""Exit the runtime context and return a Boolean flag indicating if any exception that occurred should be suppressed. If an exception occurred during execution of the suite, its type, value, and traceback are passed as arguments to __exit__(). Otherwise, all three arguments are None. This method should return True if the exception should be suppressed, or False if the exception should be re-raised with the normal exception handling."""
"What are callable types?, ""These are the types to which the function call operation (see section Calls) can be applied: Function, Methods, Class Types, Class Instances, Code Objects"""
"What is a function?, ""A function object is a wrapper around a function. It is a Python object which is callable and can be passed as an argument to another function."""
"What is a method?, ""A method is a function that is associated with an object. You can call methods on an object using the dot notation (e.g., obj.method())."""
"What are class types?, ""A class’s type is the type of its instances. Generally, class objects are callable (to produce a new instance), but class objects can be made non-callable by overriding __call__()."""
"What are class instances?, ""Instances of a class can be made callable by defining a __call__() method in their class."""
"What are code objects?, ""A code object is a compiled sequence of Python byte code instructions. It is what most functions are turned into at compile time."""
"What is a module object?, ""A module object is a basic organizational unit of Python code, and is created by the import system as it encounters import statements (as well as by calls to built-in functions such as importlib.reload()). A module object has a namespace implemented by a dictionary object."""
"What is a custom class?, ""A custom class is typically created by a class definition in a module."""
"What are instance attributes?, ""Class instances have a namespace implemented as a dictionary which is the first place in which attribute references are searched. When an attribute is not found in this dictionary, and the instance’s class has an attribute by that name, the search continues with the class attributes."""
"What are callable class instances?, ""Callable class instances, by default, all class instances have a dictionary for attribute storage."""
"What is a built-in function object?, ""Built-in function objects are wrappers around C functions. Examples of built-in functions include len() and math.sin() (math is an example of a built-in module)."""
"What are built-in method objects?, ""These really are just a different disguise of built-in functions, this time containing an object passed to them as the ‘self’ argument. An example of a built-in method is alist.append(), assume alist is a list object."""
"What are the important implementation details for Python objects?, ""Object representations are exposed in different ways in CPython. In C, all Python objects are represented by a PyObject C struct."""
"What is the PyObject struct?, ""This contains the object’s type pointer and reference count."""
"What is an object's type pointer?, ""The type pointer points to the object’s type object."""
"What is an object's reference count?, ""The reference count is used by the CPython memory manager."""
"What are the types of objects?, ""The standard object type hierarchy is described below. It lists the built-in types that Python supports. Extension types (defined in C, C++, or other languages) are not listed, except for some of the more important ones like object. Additional base types that are not strictly defined by Python are described towards the end of the hierarchy."""
"What is the ultimate base class of all objects?, ""None, and object are the ultimate base classes of all objects."""
"What is the type of None?, ""The None type has a single value, None. Objects of this type are not writable. It is called NoneType in the C Python API."""
"What is the base class for all class types?, ""object is the base class for all class types. It does not have a dictionary, so the object.__dict__ attribute cannot be assigned to. object does not have a __weakref__ slot, so attributes cannot be weakly referenced."""
"What are the numeric types?, ""Python has three distinct numeric types: integers, floating point numbers, and complex numbers."""
"What is the integer type?, ""These represent numbers in an unlimited range, subject to available (virtual) memory. Shift and bitmask operations are assumed to be carried out in a two’s complement variant of binary arithmetic, and negative numbers are represented in the two’s complement variant."""
"What is the integer type for Boolean values?, ""Boolean values are implemented as a subtype of integers. The integer type has one more bit representation rule specific to non-negative integers. The integers 0 and 1 are the only objects that ever have this rule."""
"What is the floating point type?, ""These represent floating point numbers and are represented internally as double-precision (64 bit) floating point numbers. Usually referred to as floats."""
"What is the complex number type?, ""These represent complex numbers as a pair of machine-level double precision floating point numbers. The same caveats apply as for floating point numbers regarding representational accuracies."""
"What are sequence types?, ""These represent finite ordered index sets. The index set is a set of non-negative whole numbers. All sequences are iterable. The built-in function len() returns the number of items of a sequence. When the length of a sequence is n, the index set contains the numbers 0, 1, ..., n-1. Item a of sequence a has index i if 0 <= i < n. Python also supports slicing."""
"What are the immutable sequence types?, ""An immutable sequence object cannot be changed after it is created. (If another object needs to be created with a different value, this is usually achieved by computing a return value of a certain operation.)"""
"What are the immutable sequence types in Python?, ""The following types are immutable sequences: String, Unicode, Tuple, Bytes, Byte Array, Range."""
"What is the string type?, ""These represent immutable sequences of Unicode code points. All of the items in a string are Unicode code points represented as Unicode strings of length 1."""
"What is the tuple type?, ""These represent immutable sequences of arbitrary Python objects. Tuples of two or more items are formed by comma-separated lists of expressions. There is also a special syntax to represent empty tuples: the pair of parentheses. The sole item in a one-tuple (a ‘singleton’) can be formed by affixing a comma to an expression (an expression by itself does not create a tuple, since parentheses must be usable for grouping of expressions). Tuples are used for grouping together related data, such as the x, y coordinates of a point. Tuples are also used for immutable sequences of heterogeneous data (such as the 2-tuples produced by the enumerate() built-in)."""
"What is the bytes type?, ""Bytes objects are immutable sequences of single bytes. There are two literal forms for bytes: Literals for bytes are always prefixed with 'b' or 'B'; they produce an instance of the bytes type instead of the str type. Only ASCII characters are permitted in bytes literals; any code unit with a numeric value greater than 127 must be expressed as an escape. Like string literals, bytes literals may also be prefixed with an 'r'."""
"What is the range type?, ""Rather than being a function, range is actually an immutable sequence type dedicated to representing ranges of integers. They are commonly used for looping, but are useful in a number of other contexts. The advantage of range objects is that they always take the same (small) amount of memory, no matter how big the range they represent. Range objects implement all of the common sequence operations except concatenation and repetition (due to the fact that range objects can only represent sequences that follow a strict pattern and repetition will often violate that pattern)."""
"What are the mutable sequence types?, ""Mutable sequences can be changed after they are created."""
"What are the mutable sequence types in Python?, ""The following types are mutable sequences: List, Byte Array."""
"What is the list type?, ""Lists are mutable sequences, typically used to store collections of homogeneous items (although there are no strict restrictions on the type or mutability of the items). Lists may be constructed in several ways: Using a pair of square brackets to denote the empty list:; Using square brackets, separating items with commas: [a], [a, b, c]; Using a list comprehension: [x for x in iterable]; Using the type constructor: list() or list(iterable)."""
"What is the byte array type?, ""The bytearray type is a mutable sequence of integers in the range 0 <= x < 256. It has most of the usual methods of mutable sequences, described in Mutable Sequence Types, as well as most of the methods that the bytes type has. Byte arrays can be created in various ways: Creating an empty instance: bytearray(); Creating an instance of the same size as iterable: bytearray(iterable); Creating a copy of an existing binary data: bytearray(string, encoding[, errors]); Creating from a buffer object: bytearray(object)."""
"What are set types?, ""These represent unordered, finite sets of unique, immutable objects. As such, they cannot be indexed by any subscript. However, they can be iterated over, and the built-in function len() returns the number of items in a set."""
"What are the built-in set types?, ""Python provides two built-in set types: sets and frozensets."""
"What is the set type?, ""These represent a mutable set. They are created by the built-in set() constructor and can be modified afterwards by several methods, such as add()."""
"What is the frozenset type?, ""These represent an immutable set. They are created by the built-in frozenset() constructor. As a frozenset is immutable and hashable, it can be used again as an element of another set, or as a dictionary key. For the moment, only hashable objects can be members of a set."""
"What are mapping types?, ""These represent finite sets of objects indexed by arbitrary index sets. Mappings are mutable objects. There is currently only one standard mapping type, the dictionary."""
"What is the dictionary type?, ""These represent finite sets of objects indexed by nearly arbitrary values. Dictionaries are mutable objects. They are created by the {key: value, ...} notation. Dictionaries are extensively used in the implementation of every Python object: attribute lookup, item import, and globals and locals are all stored in dictionaries."""
"What is the dictionary view objects?, ""The objects returned by dict.keys(), dict.values() and dict.items() are view objects. They provide a dynamic view on the dictionary’s entries, which means that when the dictionary changes, the view reflects these changes. Dictionary views can be iterated over to yield their respective data, and support membership tests:"""
"What are callable types?, ""These are the types to which the function call operation (see section Calls) can be applied: Function, Methods, Class Types, Class Instances, Code Objects"""
"What is the function type?, ""A function object is a wrapper around a function. It is a Python object which is callable and can be passed as an argument to another function."""
"What is the method type?, ""A method is a function that is associated with an object. You can call methods on an object using the dot notation (e.g., obj.method()). There are two flavors: built-in methods (such as list.append()) and class instance methods."""
"What are class types?, ""A class’s type is the type of its instances. Generally, class objects are callable (to produce a new instance), but class objects can be made non-callable by overriding __call__()."""
"What are class instance types?, ""Instances of a class can be made callable by defining a __call__() method in their class."""
"What are code object types?, ""Code objects represent byte-compiled executable Python code, or bytecode. The difference between a code object and a function object is that the function object contains an explicit reference to the function’s (global) globals, while a code object contains no context; also the function object contains default parameter values. A code object is immutable and contains no references (directly or indirectly) to mutable objects. Code objects are not directly accessible as a return value by a built-in function, but can be obtained by importing the types module and by getting it from a function’s __code__ attribute."""
"What is the type of Boolean operations?, ""These represent the truth values False and True."""
"What is the type of the None object?, ""This type has a single value, None. Objects of this type are not writable. It is called NoneType in the C Python API."""
"What are iterator types?, ""Python supports a concept of iteration over containers. These are implemented using two distinct methods; these are used to allow user-defined classes to support iteration."""
"What is the old-style iterator protocol?, ""One type of iterator object is defined by having a __getitem__() method. Python uses the following process if it is attempting to iterate over an object (where obj is the sequence object): it calls __getitem__() with consecutive integers starting with 0 as an index (if the integer is out of range, IndexError is raised; any other exception is propagated). When the caller is done with a sequence, or if the sequence is infinite, no further calls are made to __getitem__()."""
"What is the current iterator protocol?, ""An iterator object itself is required to support the following two methods, which together form the iterator protocol: __iter__(), __next__()"""
"What does the __iter__() method of an iterator object do?, ""Return the iterator object itself. This is required to allow both containers and iterators to be used with the for and in statements. This method corresponds to the “first” step in iteration: it returns the iterator object itself."""
"What does the __next__() method of an iterator object do?, ""Return the next item from the container. If there are no further items, raise the StopIteration exception. This method corresponds to the “next” step in iteration, and is also the equivalent of the next() built-in function."""
"What are generator types?, ""Python’s generator provides a convenient way to implement the iterator protocol. If a container object’s __iter__() method is implemented as a generator, it will automatically return an iterator object (technically, a generator object), which supplies the __iter__() and __next__() methods. Generator expressions provide a more convenient yet even more compact way to create iterator objects."""
"What is the type of class instances?, ""Class instances are created by calling a class object (for example, if Class is a class object, then Class() creates a new instance of that class). Class instances have a namespace implemented as a dictionary which is the first place in which attribute references are searched. When an attribute is not found in this dictionary, and the instance’s class has an attribute by that name, the search continues with the class attributes. If a class instance attribute is found that is a user-defined function object, it is transformed into an instance method object whose __self__ attribute is the instance. Static class and abstract class objects do not support the creation of instances either through a regular call or subclassing (attempting to create a subclass of such an object will raise a TypeError)."""
"What is the type of modules?, ""Modules are a basic organizational unit of Python code, and are created by the import system as it encounters import statements (as well as by calls to built-in functions such as importlib.reload()). A module has a namespace implemented by a dictionary object (this is the dictionary referenced by the func.__globals__ attribute of functions defined in the module)."""
"What is the type of a custom class?, ""Custom class types are typically created by class definitions (see section Class definitions). A class has a namespace implemented by a dictionary object. Class instance attributes are found in the dictionary of the"
"What is the value of an object?, ""The value of some objects can change. Objects whose value can change are said to be mutable; objects whose value is unchangeable once they are created are called immutable. An object’s mutability is determined by its type; for instance, numbers, strings and tuples are immutable, while dictionaries and lists are mutable."""
"What is a module?, ""Modules are the basic organizational unit of Python code, and are created by the import system as it encounters import statements (as well as by calls to built-in functions such as importlib.reload()). Each module has its own symbol table, used as the global symbol table for all objects defined in the module. Modules can contain executable statements as well as function definitions."""
"What is a class?, ""A class object serves as a template for creating instances. Classes support inheritance, which is a mechanism of reusing implementations from one or more base classes, allowing you to define a type by terms of another type. A class has a namespace implemented by a dictionary object (this is the dictionary referenced by Class.__dict__). Class instance attributes are found in the dictionary of the instance as well as in the class’s namespace and those of its base classes."""
"What is an instance?, ""A class instance is a concrete occurrence of a class. Each instance has its own namespace implemented as a dictionary, and this is the first place in which attribute references are searched. When an attribute is not found in this dictionary, and the instance’s class has an attribute by that name, the search continues with the class attributes."""
"What is a function?, ""A function object is a callable object created by a function definition. When it is called, it gives access to a separate namespace (the function’s local namespace). Parameter lists are defined in the function definition. An instance method object is a callable object that is the result of accessing a function object (one defined inside a class definition) through an instance of that class. It passes the instance object (that instance that the method was accessed through) as the first argument (usually called self) to the function object. A function object may or may not have a type annotation associated with it."""
"What is a method?, ""A method is a function that is associated with an object. You can call methods on an object using the dot notation (e.g., obj.method()). There are two flavors: built-in methods (such as list.append()) and class instance methods."""
"What is a code object?, ""A code object is a compiled sequence of Python byte code instructions, also called bytecode. Code objects are immutable and contain no references (directly or indirectly) to mutable objects. The executable code for a module is wrapped in a code object. Code objects are represented internally by the PyCodeObject C struct."""
"What are the principal built-in types of Python?, ""The principal built-in types are numerics, sequences, mappings, classes, instances and exceptions."""
"What are the numeric types in Python?, ""Python has the following numeric types: int, float, and complex."""
"What is the int type in Python?, ""These represent integers of unlimited range, subject to available (virtual) memory. Plain integers (also just called integers) are implemented in C using longs. Integer literals are described in the numeric literals section. Integers are immutable numeric types."""
"What is the float type in Python?, ""These represent floating point numbers and are represented internally as double-precision (64 bit) floating point numbers. Usually also known as floats. These are often implemented in C using doubles. Floating point numbers are immutable numeric types."""
"What is the complex type in Python?, ""These represent complex numbers and are represented internally as a pair of double-precision floating point numbers; the real and imaginary part. The real and imaginary parts of a complex number z can be retrieved through the read-only attributes z.real and z.imag. (The library includes the complex numeric type.) Complex numbers are immutable numeric types."""
"What are sequence types in Python?, ""These represent finite ordered index sets indexed by non-negative numbers. The built-in function len() returns the number of items of a sequence. When the length of a sequence is n, the index set contains the numbers 0, 1, ..., n-1. Item i of sequence a is selected by a[i] and slices are defined in sequence types. Sequences are classified according to their mutability; immutable sequence types (strings, tuples, bytes and range objects) and mutable sequence types (lists and bytearrays)."""
"What are the immutable sequence types in Python?, ""An immutable sequence object cannot be changed after it is created. If another object with a different value must be created, it is created with the return value of an operation. In contrast, mutable sequence objects can be changed in place. The following types are immutable sequences: String, Unicode, Tuple, Bytes, Byte Array, Range."""
"What is the string type in Python?, ""Strings are immutable sequences of Unicode code points. There is one string type: str. Strings are sequences of Unicode code points represented as Unicode strings in memory. Unicode code points in the range U+0000—U+10FFFF can be represented in a string. Strings can be written in a variety of ways, including single quotes, double quotes, triple quotes, and escape sequences."""
"What is the tuple type in Python?, ""Tuples are immutable sequences of arbitrary Python objects. Tuples are sequences of arbitrary Python objects. Tuples are written as comma-separated values, optionally enclosed in parentheses. Tuples are immutable, and typically contain a heterogeneous sequence of elements that are accessed via unpacking (see section Assignment statements) or indexing (or even by attribute in the case of named tuples). Lists are mutable, and their elements are usually homogeneous and are accessed by iterating over the list."""
"What is the bytes type in Python?, ""Bytes objects are immutable sequences of single bytes. There are exactly two built-in bytes object types: bytes and bytearray. Bytes objects are immutable sequences of single bytes. Many of the string methods are available for bytes objects as well."""
"What is the byte array type in Python?, ""Byte array objects are a mutable counterpart to bytes objects. There is a dedicated type to handle binary data: the bytes type, and the mutable bytearray type. They are defined in the bytes and bytearray types section."""
