"question,expected_answer"
"What are modules?, ""Modules are the basic organizational unit of Python code, and are created by the import system as it encounters import statements (as well as by calls to built-in functions such as importlib.reload())."""
"How is the symbol table of a module used?, ""Each module has its own symbol table, used as the global symbol table for all objects defined in the module."""
"What can modules contain?, ""Modules can contain executable statements as well as function definitions."""
"What is a class?, ""A class object serves as a template for creating instances."""
"What does a class support?, ""Classes support inheritance, which is a mechanism of reusing implementations from one or more base classes, allowing you to define a type by terms of another type."""
"How is the namespace of a class implemented?, ""A class has a namespace implemented by a dictionary object (this is the dictionary referenced by Class.__dict__)."""
"Where are class instance attributes found?, ""Class instance attributes are found in the dictionary of the instance as well as in the class’s namespace and those of its base classes."""
"What is an instance?, ""A class instance is a concrete occurrence of a class."""
"How is the namespace of an instance implemented?, ""Each instance has its own namespace implemented as a dictionary, and this is the first place in which attribute references are searched."""
"What happens if an attribute is not found in an instance's dictionary?, ""When an attribute is not found in this dictionary, and the instance’s class has an attribute by that name, the search continues with the class attributes."""
"What is a function?, ""A function object is a callable object created by a function definition."""
"What does a function object give access to when called?, ""When it is called, it gives access to a separate namespace (the function’s local namespace)."""
"Where are parameter lists defined?, ""Parameter lists are defined in the function definition."""
"What is an instance method object?, ""An instance method object is a callable object that is the result of accessing a function object (one defined inside a class definition) through an instance of that class."""
"What argument is passed to the function object in an instance method object?, ""It passes the instance object (that instance that the method was accessed through) as the first argument (usually called self) to the function object."""
"May a function object have a type annotation?, ""A function object may or may not have a type annotation associated with it."""
"What is a method?, ""A method is a function that is associated with an object."""
"How can methods be called on an object?, ""You can call methods on an object using the dot notation (e.g., obj.method())."""
"What are the flavors of methods?, ""There are two flavors: built-in methods (such as list.append()) and class instance methods."""
"What is a code object?, ""A code object is a compiled sequence of Python byte code instructions, also called bytecode."""
"Are code objects mutable or immutable?, ""Code objects are immutable and contain no references (directly or indirectly) to mutable objects."""
"What is wrapped in a code object?, ""The executable code for a module is wrapped in a code object."""
"How are code objects represented internally?, ""Code objects are represented internally by the PyCodeObject C struct."""
"What are the principal built-in types of Python?, ""The principal built-in types are numerics, sequences, mappings, classes, instances and exceptions."""
"What are the numeric types in Python?, ""Python has the following numeric types: int, float, and complex."""
"What is the int type in Python?, ""These represent integers of unlimited range, subject to available (virtual) memory."""
"How are plain integers implemented in C?, ""Plain integers (also just called integers) are implemented in C using longs."""
"Where are integer literals described?, ""Integer literals are described in the numeric literals section."""
"Are integers mutable numeric types?, ""Integers are immutable numeric types."""
"What is the float type in Python?, ""These represent floating point numbers and are represented internally as double-precision (64 bit) floating point numbers."""
"What are floating point numbers often implemented in C?, ""These are often implemented in C using doubles."""
"Are floating point numbers mutable numeric types?, ""Floating point numbers are immutable numeric types."""
"What is the complex type in Python?, ""These represent complex numbers and are represented internally as a pair of double-precision floating point numbers; the real and imaginary part."""
"How can the real and imaginary parts of a complex number be retrieved?, ""The real and imaginary parts of a complex number z can be retrieved through the read-only attributes z.real and z.imag. (The library includes the complex numeric type.)"""
"Are complex numbers mutable numeric types?, ""Complex numbers are immutable numeric types."""
"What are sequence types in Python?, ""These represent finite ordered index sets indexed by non-negative numbers."""
"What built-in function returns the number of items of a sequence?, ""The built-in function len() returns the number of items of a sequence."""
"If the length of a sequence is n, what numbers does the index set contain?, ""When the length of a sequence is n, the index set contains the numbers 0, 1, ..., n-1."""
"How is item i of sequence a selected?, ""Item i of sequence a is selected by a[i] and slices are defined in sequence types."""
"How are sequences classified?, ""Sequences are classified according to their mutability; immutable sequence types (strings, tuples, bytes and range objects) and mutable sequence types (lists and bytearrays)."""
"What are immutable sequence types in Python?, ""An immutable sequence object cannot be changed after it is created."""
"How is another object with a different value created for immutable sequences?, ""If another object with a different value must be created, it is created with the return value of an operation."""
"How can mutable sequence objects be changed?, ""In contrast, mutable sequence objects can be changed in place."""
"What types are immutable sequences?, ""The following types are immutable sequences: String, Unicode, Tuple, Bytes, Byte Array, Range."""
"What type are strings in Python?, ""Strings are immutable sequences of Unicode code points."""
"What string type is there in Python?, ""There is one string type: str."""
"How are strings represented in memory?, ""Strings are sequences of Unicode code points represented as Unicode strings in memory."""
"What range of Unicode code points can be represented in a string?, ""Unicode code points in the range U+0000—U+10FFFF can be represented in a string."""
"How can strings be written?, ""Strings can be written in a variety of ways, including single quotes, double quotes, triple quotes, and escape sequences."""
"What type are tuples in Python?, ""Tuples are immutable sequences of arbitrary Python objects."""
"How are tuples written?, ""Tuples are written as comma-separated values, optionally enclosed in parentheses."""
"What do tuples typically contain?, ""Tuples are immutable, and typically contain a heterogeneous sequence of elements that are accessed via unpacking (see section Assignment statements) or indexing (or even by attribute in the case of named tuples)."""
"How are list elements accessed?, ""Lists are mutable, and their elements are usually homogeneous and are accessed by iterating over the list."""
"What type are bytes objects?, ""Bytes objects are immutable sequences of single bytes."""
"How many built-in bytes object types are there?, ""There are exactly two built-in bytes object types: bytes and bytearray."""
"Are bytes objects mutable?, ""Bytes objects are immutable sequences of single bytes."""
"What methods are available for bytes objects?, ""Many of the string methods are available for bytes objects as well."""
"What type are byte array objects?, ""Byte array objects are a mutable counterpart to bytes objects."""
"What is the purpose of the bytes type and the bytearray type?, ""There is a dedicated type to handle binary data: the bytes type, and the mutable bytearray type."""
"Where are bytes and bytearray types defined?, ""They are defined in the bytes and"
"What is the range type in Python?, ""Rather than being a function, range is actually an immutable sequence type dedicated to representing ranges of integers."""
"What are range types commonly used for?, ""They are commonly used for looping, but are useful in a number of other contexts."""
"What is the advantage of range objects?, ""The advantage of range objects is that they always take the same (small) amount of memory, no matter how big the range they represent."""
"What sequence operations do range objects implement?, ""Range objects implement all of the common sequence operations except concatenation and repetition (due to the fact that range objects can only represent sequences that follow a strict pattern and repetition will often violate that pattern)."""
"What are the mutable sequence types in Python?, ""Mutable sequences can be changed after they are created."""
"What types are mutable sequences?, ""The following types are mutable sequences: List, Byte Array."""
"What is the list type in Python?, ""Lists are mutable sequences, typically used to store collections of homogeneous items (although there are no strict restrictions on the type or mutability of the items)."""
"How can lists be constructed?, ""Lists may be constructed in several ways: Using a pair of square brackets to denote the empty list:; Using square brackets, separating items with commas: [a], [a, b, c]; Using a list comprehension: [x for x in iterable]; Using the type constructor: list() or list(iterable)."""
"What are set types in Python?, ""These represent unordered, finite sets of unique, immutable objects."""
"Can set types be indexed by any subscript?, ""As such, they cannot be indexed by any subscript."""
"Can set types be iterated over?, ""However, they can be iterated over, and the built-in function len() returns the number of items in a set."""
"What are the built-in set types in Python?, ""Python provides two built-in set types: sets and frozensets."""
"What is the set type in Python?, ""These represent a mutable set."""
"How are set types created?, ""They are created by the built-in set() constructor and can be modified afterwards by several methods, such as add()."""
"What is the frozenset type in Python?, ""These represent an immutable set."""
"How are frozenset types created?, ""They are created by the built-in frozenset() constructor."""
"Can frozensets be used as elements of another set?, ""As a frozenset is immutable and hashable, it can be used again as an element of another set, or as a dictionary key."""
"What types of objects can be members of a set?, ""For the moment, only hashable objects can be members of a set."""
"What are mapping types in Python?, ""These represent finite sets of objects indexed by arbitrary index sets."""
"Are mappings mutable or immutable objects?, ""Mappings are mutable objects."""
"What is the standard mapping type?, ""There is currently only one standard mapping type, the dictionary."""
"What is the dictionary type in Python?, ""These represent finite sets of objects indexed by nearly arbitrary values."""
"Are dictionaries mutable or immutable objects?, ""Dictionaries are mutable objects."""
"How are dictionaries created?, ""They are created by the {key: value, ...} notation."""
"Where are dictionaries extensively used?, ""Dictionaries are extensively used in the implementation of every Python object: attribute lookup, item import, and globals and locals are all stored in dictionaries."""
"What are dictionary view objects in Python?, ""The objects returned by dict.keys(), dict.values() and dict.items() are view objects."""
"What kind of view do dictionary view objects provide?, ""They provide a dynamic view on the dictionary’s entries, which means that when the dictionary changes, the view reflects these changes."""
"Can dictionary views be iterated over?, ""Dictionary views can be iterated over to yield their respective data, and support membership tests:"""
"What are callable types in Python?, ""These are the types to which the function call operation (see section Calls) can be applied: Function, Methods, Class Types, Class Instances, Code Objects"""
"What is the function type in Python?, ""A function object is a wrapper around a function."""
"What is a Python function object?, ""It is a Python object which is callable and can be passed as an argument to another function."""
"What is the method type in Python?, ""A method is a function that is associated with an object."""
"How can methods be called?, ""You can call methods on an object using the dot notation (e.g., obj.method())."""
"What flavors of methods are there?, ""There are two flavors: built-in methods (such as list.append()) and class instance methods."""
"What are class types in Python?, ""A class’s type is the type of its instances."""
"Are class objects generally callable?, ""Generally, class objects are callable (to produce a new instance), but class objects can be made non-callable by overriding __call__()."""
"What are class instance types in Python?, ""Instances of a class can be made callable by defining a __call__() method in their class."""
"What are code object types in Python?, ""Code objects represent byte-compiled executable Python code, or bytecode."""
"What is the difference between a code object and a function object?, ""The difference between a code object and a function object is that the function object contains an explicit reference to the function’s (global) globals, while a code object contains no context; also the function object contains default parameter values."""
"Are code objects mutable?, ""A code object is immutable and contains no references (directly or indirectly) to mutable objects."""
"How can code objects be obtained?, ""Code objects are not directly accessible as a return value by a built-in function, but can be obtained by importing the types module and by getting it from a function’s __code__ attribute."""
"What is the type of Boolean operations?, ""These represent the truth values False and True."""
"What is the type of the None object?, ""This type has a single value, None. Objects of this type are not writable. It is called NoneType in the C Python API."""
"What are iterator types in Python?, ""Python supports a concept of iteration over containers."""
"How are iterator types implemented?, ""These are implemented using two distinct methods; these are used to allow user-defined classes to support iteration."""
"What is the old-style iterator protocol in Python?, ""One type of iterator object is defined by having a __getitem__() method."""
"How does Python use the __getitem__() method for iteration?, ""Python uses the following process if it is attempting to iterate over an object (where obj is the sequence object): it calls __getitem__() with consecutive integers starting with 0 as an index (if the integer is out of range, IndexError is raised; any other exception is propagated). When the caller is done with a sequence, or if the sequence is infinite, no further calls are made to __getitem__()."""
"What is the current iterator protocol in Python?, ""An iterator object itself is required to support the following two methods, which together form the iterator protocol: __iter__(), __next__()"""
"What does the __iter__() method of an iterator object do?, ""Return the iterator object itself. This is required to allow both containers and iterators to be used with the for and in statements. This method corresponds to the “first” step in iteration: it returns the iterator object itself."""
"What does the __next__() method of an iterator object do?, ""Return the next item from the container. If there are no further items, raise the StopIteration exception. This method corresponds to the “next” step in iteration, and is also the equivalent of the next() built-in function."""
"What are generator types in Python?, ""Python’s generator provides a convenient way to implement the iterator protocol."""
"How do generator types implement the iterator protocol?, ""If a container object’s __iter__() method is implemented as a generator, it will automatically return an iterator object (technically, a generator object), which supplies the __iter__() and __next__() methods."""
"What is another way to create iterator objects?, ""Generator expressions provide a more convenient yet even more compact way to create iterator objects."""
"What is the type of class instances?, ""Class instances are created by calling a class object (for example, if Class is a class object, then Class() creates a new instance of that class)."""
"How is the namespace of class instances implemented?, ""Class instances have a namespace implemented as a dictionary which is the first place in which attribute references are searched."""
"What happens if an attribute is not found in the instance's dictionary?, ""When an attribute is not found in this dictionary, and the instance’s class has an attribute by that name, the search continues with the class attributes."""
"What happens if a class instance attribute is a user-defined function object?, ""If a class instance attribute is found that is a user-defined function object, it is transformed into an instance method object whose __self__ attribute is the instance."""
"Do static, class, and abstract class objects support instance creation?, ""Static class and abstract class objects do not support the creation of instances either through a regular call or subclassing (attempting to create a subclass of such an object will raise a TypeError)."""
"What is the type of modules?, ""Modules are a basic organizational unit of Python code, and are created by the import system as it encounters import statements (as well as by calls to built-in functions such as importlib.reload())."""
"How is the namespace of a module implemented?, ""A module has a namespace implemented by a dictionary object (this is the dictionary referenced by the func.__globals__ attribute of functions defined in the module)."""
"How are custom class types typically created?, ""Custom class types are typically created by class definitions (see section Class definitions)."""
"How is the namespace of a class implemented?, ""A class has a namespace implemented by a dictionary object."""
"Where are class instance attributes found?, ""Class instance attributes are found in the dictionary of the instance as well as in the class’s namespace and those of its base classes."""
"What is the type of class objects?, ""A class object is a callable that produces a new instance of the class (for example, Class())."""
"How is an object's type accessed?, ""An object’s type is accessed by the built-in function type()."""
"Are there special operations on type objects?, ""There are no special operations on types themselves."""
"What module defines names for all standard built-in types?, ""The standard module types defines names for all standard built-in types (some of which are the same names as the built-in functions); this is normally imported as follows: import types."""
"What is the identity of an object?, ""An object’s identity never changes once it has been created; you may think of it as the object’s address in memory."""
"How can you think of an object's identity?, ""You may think of it as the object’s address in memory."""
"What operator compares the identity of two objects?, ""The ‘is’ operator compares the identity of two objects."""
"What function returns an integer representing an object's identity?, ""The id() function returns an integer representing its identity."""
"What is the value of an object?, ""The value of some objects can change."""
"What are mutable objects?, ""Objects whose value can change are said to be mutable."""
"What are immutable objects?, ""Objects whose value is unchangeable once they are created are called immutable."""
"What determines an object's mutability?, ""An object’s mutability is determined by its type; for instance, numbers, strings and tuples are immutable, while dictionaries and lists are mutable."""
"What are modules?, ""Modules are the basic organizational unit of Python code, and are created by the import system as it encounters import statements (as well as by calls to built-in functions such as importlib.reload())."""
"How is the symbol table of a module used?, ""Each module has its own symbol table, used as the global symbol table for all objects defined in the module."""
"What can modules contain?, ""Modules can contain executable statements as well as function definitions."""
"What is a class?, ""A class object serves as a template for creating instances."""
"What does a class support?, ""Classes support inheritance, which is a mechanism of reusing implementations from one or more base classes, allowing you to define a type by terms of another type."""
"How is the namespace of a class implemented?, ""A class has a namespace implemented by a dictionary object (this is the dictionary referenced by Class.__dict__)."""
"Where are class instance attributes found?, ""Class instance attributes are found in the dictionary of the instance as well as in the class’s namespace and those of its base classes."""
"What is an instance?, ""A class instance is a concrete occurrence of a class."""
"How is the namespace of an instance implemented?, ""Each instance has its own namespace implemented as a dictionary, and this is the first place in which attribute references are searched."""
"What happens if an attribute is not found in an instance's dictionary?, ""When an attribute is not found in this dictionary, and the instance’s class has an attribute by that name, the search continues with the class attributes."""
"What is a function?, ""A function object is a callable object created by a function definition."""
"What does a function object give access to when called?, ""When it is called, it gives access to a separate namespace (the function’s local namespace)."""
"Where are parameter lists defined?, ""Parameter lists are defined in the function definition."""
"What is an instance method object?, ""An instance method object is a callable object that is the result of accessing a function object (one defined inside a class definition) through an instance of that class."""
"What argument is passed to the function object in an instance method object?, ""It passes the instance object (that instance that the method was accessed through) as the first argument (usually called self) to the function object."""
"May a function object have a type annotation?, ""A function object may or may not have a type annotation associated with it."""
"What is a method?, ""A method is a function that is associated with an object."""
"How can methods be called on an object?, ""You can call methods on an object using the dot notation (e.g., obj.method())."""
"What are the flavors of methods?, ""There are two flavors: built-in methods (such as list.append()) and class instance methods."""
"What is a code object?, ""A code object is a compiled sequence of Python byte code instructions, also called bytecode."""
"Are code objects mutable or immutable?, ""Code objects are immutable and contain no references (directly or indirectly) to mutable objects."""
"What is wrapped in a code object?, ""The executable code for a module is wrapped in a code object."""
"How are code objects represented internally?, ""Code objects are represented internally by the PyCodeObject C struct."""
"What are the principal built-in types of Python?, ""The principal built-in types are numerics, sequences, mappings, classes, instances and exceptions."""
"What are the numeric types in Python?, ""Python has the following numeric types: int, float, and complex."""
"What is the int type in Python?, ""These represent integers of unlimited range, subject to available (virtual) memory."""
"How are plain integers implemented in C?, ""Plain integers (also just called integers) are implemented in C using longs."""
"Where are integer literals described?, ""Integer literals are described in the numeric literals section."""
"Are integers mutable numeric types?, ""Integers are immutable numeric types."""
"What is the float type in Python?, ""These represent floating point numbers and are represented internally as double-precision (64 bit) floating point numbers."""
"What are floating point numbers often implemented in C?, ""These are often implemented in C using doubles."""
"Are floating point numbers mutable numeric types?, ""Floating point numbers are immutable numeric types."""
"What is the complex type in Python?, ""These represent complex numbers and are represented internally as a pair of double-precision floating point numbers; the real and imaginary part."""
"How can the real and imaginary parts of a complex number be retrieved?, ""The real and imaginary parts of a complex number z can be retrieved through the read-only attributes z.real and z.imag. (The library includes the complex numeric type.)"""
"Are complex numbers mutable numeric types?, ""Complex numbers are immutable numeric types."""
"What are sequence types in Python?, ""These represent finite ordered index sets indexed by non-negative numbers."""
"What built-in function returns the number of items of a sequence?, ""The built-in function len() returns the number of items of a sequence."""
