"question,expected_answer"
"What is the value of an object?, ""The value of some objects can change. Objects whose value can change are said to be mutable; objects whose value is unchangeable once they are created are called immutable. An object’s mutability is determined by its type; for instance, numbers, strings and tuples are immutable, while dictionaries and lists are mutable."""
"What is a module?, ""Modules are the basic organizational unit of Python code, and are created by the import system as it encounters import statements (as well as by calls to built-in functions such as importlib.reload()). Each module has its own symbol table, used as the global symbol table for all objects defined in the module. Modules can contain executable statements as well as function definitions."""
"What is a class?, ""A class object serves as a template for creating instances. Classes support inheritance, which is a mechanism of reusing implementations from one or more base classes, allowing you to define a type by terms of another type. A class has a namespace implemented by a dictionary object (this is the dictionary referenced by Class.__dict__). Class instance attributes are found in the dictionary of the instance as well as in the class’s namespace and those of its base classes."""
"What is an instance?, ""A class instance is a concrete occurrence of a class. Each instance has its own namespace implemented as a dictionary, and this is the first place in which attribute references are searched. When an attribute is not found in this dictionary, and the instance’s class has an attribute by that name, the search continues with the class attributes."""
"What is a function?, ""A function object is a callable object created by a function definition. When it is called, it gives access to a separate namespace (the function’s local namespace). Parameter lists are defined in the function definition. An instance method object is a callable object that is the result of accessing a function object (one defined inside a class definition) through an instance of that class. It passes the instance object (that instance that the method was accessed through) as the first argument (usually called self) to the function object. A function object may or may not have a type annotation associated with it."""
"What is a method?, ""A method is a function that is associated with an object. You can call methods on an object using the dot notation (e.g., obj.method()). There are two flavors: built-in methods (such as list.append()) and class instance methods."""
"What is a code object?, ""A code object is a compiled sequence of Python byte code instructions, also called bytecode. Code objects are immutable and contain no references (directly or indirectly) to mutable objects. The executable code for a module is wrapped in a code object. Code objects are represented internally by the PyCodeObject C struct."""
"What are the principal built-in types of Python?, ""The principal built-in types are numerics, sequences, mappings, classes, instances and exceptions."""
"What are the numeric types in Python?, ""Python has the following numeric types: int, float, and complex."""
"What is the int type in Python?, ""These represent integers of unlimited range, subject to available (virtual) memory. Plain integers (also just called integers) are implemented in C using longs. Integer literals are described in the numeric literals section. Integers are immutable numeric types."""
"What is the float type in Python?, ""These represent floating point numbers and are represented internally as double-precision (64 bit) floating point numbers. Usually also known as floats. These are often implemented in C using doubles. Floating point numbers are immutable numeric types."""
"What is the complex type in Python?, ""These represent complex numbers and are represented internally as a pair of double-precision floating point numbers; the real and imaginary part. The real and imaginary parts of a complex number z can be retrieved through the read-only attributes z.real and z.imag. (The library includes the complex numeric type.) Complex numbers are immutable numeric types."""
"What are sequence types in Python?, ""These represent finite ordered index sets indexed by non-negative numbers. The built-in function len() returns the number of items of a sequence. When the length of a sequence is n, the index set contains the numbers 0, 1, ..., n-1. Item i of sequence a is selected by a[i] and slices are defined in sequence types. Sequences are classified according to their mutability; immutable sequence types (strings, tuples, bytes and range objects) and mutable sequence types (lists and bytearrays)."""
"What are the immutable sequence types in Python?, ""An immutable sequence object cannot be changed after it is created. If another object with a different value must be created, it is created with the return value of an operation. In contrast, mutable sequence objects can be changed in place. The following types are immutable sequences: String, Unicode, Tuple, Bytes, Byte Array, Range."""
"What is the string type in Python?, ""Strings are immutable sequences of Unicode code points. There is one string type: str. Strings are sequences of Unicode code points represented as Unicode strings in memory. Unicode code points in the range U+0000—U+10FFFF can be represented in a string. Strings can be written in a variety of ways, including single quotes, double quotes, triple quotes, and escape sequences."""
"What is the tuple type in Python?, ""Tuples are immutable sequences of arbitrary Python objects. Tuples are sequences of arbitrary Python objects. Tuples are written as comma-separated values, optionally enclosed in parentheses. Tuples are immutable, and typically contain a heterogeneous sequence of elements that are accessed via unpacking (see section Assignment statements) or indexing (or even by attribute in the case of named tuples). Lists are mutable, and their elements are usually homogeneous and are accessed by iterating over the list."""
"What is the bytes type in Python?, ""Bytes objects are immutable sequences of single bytes. There are exactly two built-in bytes object types: bytes and bytearray. Bytes objects are immutable sequences of single bytes. Many of the string methods are available for bytes objects as well."""
"What is the byte array type in Python?, ""Byte array objects are a mutable counterpart to bytes objects. There is a dedicated type to handle binary data: the bytes type, and the mutable bytearray type. They are defined in the bytes and bytearray types section."""
"What is the range type in Python?, ""Rather than being a function, range is actually an immutable sequence type dedicated to representing ranges of integers. They are commonly used for looping, but are useful in a number of other contexts. The advantage of range objects is that they always take the same (small) amount of memory, no matter how big the range they represent. Range objects implement all of the common sequence operations except concatenation and repetition (due to the fact that range objects can only represent sequences that follow a strict pattern and repetition will often violate that pattern)."""
"What are the mutable sequence types in Python?, ""Mutable sequences can be changed after they are created. The following"
"What are the mutable sequence types in Python?, ""The following types are mutable sequences: List, Byte Array."""
"What is the list type in Python?, ""Lists are mutable sequences, typically used to store collections of homogeneous items (although there are no strict restrictions on the type or mutability of the items). Lists may be constructed in several ways: Using a pair of square brackets to denote the empty list:; Using square brackets, separating items with commas: [a], [a, b, c]; Using a list comprehension: [x for x in iterable]; Using the type constructor: list() or list(iterable)."""
"What are set types in Python?, ""These represent unordered, finite sets of unique, immutable objects. As such, they cannot be indexed by any subscript. However, they can be iterated over, and the built-in function len() returns the number of items in a set."""
"What are the built-in set types in Python?, ""Python provides two built-in set types: sets and frozensets."""
"What is the set type in Python?, ""These represent a mutable set. They are created by the built-in set() constructor and can be modified afterwards by several methods, such as add()."""
"What is the frozenset type in Python?, ""These represent an immutable set. They are created by the built-in frozenset() constructor. As a frozenset is immutable and hashable, it can be used again as an element of another set, or as a dictionary key."""
"What are mapping types in Python?, ""These represent finite sets of objects indexed by arbitrary index sets. Mappings are mutable objects. There is currently only one standard mapping type, the dictionary."""
"What is the dictionary type in Python?, ""These represent finite sets of objects indexed by nearly arbitrary values. Dictionaries are mutable objects. They are created by the {key: value, ...} notation. Dictionaries are extensively used in the implementation of every Python object: attribute lookup, item import, and globals and locals are all stored in dictionaries."""
"What are dictionary view objects in Python?, ""The objects returned by dict.keys(), dict.values() and dict.items() are view objects. They provide a dynamic view on the dictionary’s entries, which means that when the dictionary changes, the view reflects these changes. Dictionary views can be iterated over to yield their respective data, and support membership tests:"""
"What are callable types in Python?, ""These are the types to which the function call operation (see section Calls) can be applied: Function, Methods, Class Types, Class Instances, Code Objects"""
"What is the function type in Python?, ""A function object is a wrapper around a function. It is a Python object which is callable and can be passed as an argument to another function."""
"What is the method type in Python?, ""A method is a function that is associated with an object. You can call methods on an object using the dot notation (e.g., obj.method()). There are two flavors: built-in methods (such as list.append()) and class instance methods."""
"What are class types in Python?, ""A class’s type is the type of its instances. Generally, class objects are callable (to produce a new instance), but class objects can be made non-callable by overriding __call__()."""
"What are class instance types in Python?, ""Instances of a class can be made callable by defining a __call__() method in their class."""
"What are code object types in Python?, ""Code objects represent byte-compiled executable Python code, or bytecode. The difference between a code object and a function object is that the function object contains an explicit reference to the function’s (global) globals, while a code object contains no context; also the function object contains default parameter values. A code object is immutable and contains no references (directly or indirectly) to mutable objects. Code objects are not directly accessible as a return value by a built-in function, but can be obtained by importing the types module and by getting it from a function’s __code__ attribute."""
"What is the type of Boolean operations?, ""These represent the truth values False and True."""
"What is the type of the None object?, ""This type has a single value, None. Objects of this type are not writable. It is called NoneType in the C Python API."""
"What are iterator types in Python?, ""Python supports a concept of iteration over containers. These are implemented using two distinct methods; these are used to allow user-defined classes to support iteration."""
"What is the old-style iterator protocol in Python?, ""One type of iterator object is defined by having a __getitem__() method. Python uses the following process if it is attempting to iterate over an object (where obj is the sequence object): it calls __getitem__() with consecutive integers starting with 0 as an index (if the integer is out of range, IndexError is raised; any other exception is propagated). When the caller is done with a sequence, or if the sequence is infinite, no further calls are made to __getitem__()."""
"What is the current iterator protocol in Python?, ""An iterator object itself is required to support the following two methods, which together form the iterator protocol: __iter__(), __next__()"""
"What does the __iter__() method of an iterator object do?, ""Return the iterator object itself. This is required to allow both containers and iterators to be used with the for and in statements. This method corresponds to the “first” step in iteration: it returns the iterator object itself."""
"What does the __next__() method of an iterator object do?, ""Return the next item from the container. If there are no further items, raise the StopIteration exception. This method corresponds to the “next” step in iteration, and is also the equivalent of the next() built-in function."""
"What are generator types in Python?, ""Python’s generator provides a convenient way to implement the iterator protocol. If a container object’s __iter__() method is implemented as a generator, it will automatically return an iterator object (technically, a generator object), which supplies the __iter__() and __next__() methods. Generator expressions provide a more convenient yet even more compact way to create iterator objects."""
"What is the type of class instances?, ""Class instances are created by calling a class object (for example, if Class is a class object, then Class() creates a new instance of that class). Class instances have a namespace implemented as a dictionary which is the first place in which attribute references are searched. When an attribute is not found in this dictionary, and the instance’s class has an attribute by that name, the search continues with the class attributes. If a class instance attribute is found that is a user-defined function object, it is transformed into an instance method object whose __self__ attribute is the instance. Static class and abstract class objects do not support the creation of instances either through a regular call or subclassing (attempting to create a subclass of such an object will raise a TypeError)."""
"What is the type of modules?, ""Modules are a basic organizational unit of Python code, and are created by the import system as it encounters import statements (as well as by calls to built-in functions such as importlib.reload()). A module has a namespace implemented by a dictionary object (this is the dictionary referenced by the func.__globals__ attribute of functions defined in the module)."""
"What is the type of a custom class?, ""Custom class types are typically created by class definitions (see section Class definitions). A class has a namespace implemented by a dictionary object. Class instance attributes are found in the dictionary of the instance as well as in the class’s namespace and those of its base classes."""
"What is the type of class objects?, ""A class object is a callable that produces a new instance of the class (for example, Class())."""
"What is the type of type objects?, ""Type objects represent the various object types. An object’s type is accessed by the built-in function type(). There are no special operations on types themselves. The standard module types defines names for all standard built-in types (some of which are the same names as the built-in functions); this is normally imported as follows: import types."""
"What is the identity of an object?, ""An object’s identity never changes once it has been created; you may think of it as the object’s address in memory. The ‘is’ operator compares the identity of two objects. The ‘is’ operator compares the identity of two objects. The id() function returns an integer representing its identity."""
"What is the value of an object?, ""The value of some objects can change. Objects whose value can change are said to be mutable; objects whose value is unchangeable once they are created are called immutable. An object’s mutability is determined by its type; for instance, numbers, strings and tuples are immutable, while dictionaries and lists are mutable."""
"What is a module?, ""Modules are the basic organizational unit of Python code, and are created by the import system as it encounters import statements (as well as by calls to built-in functions such as importlib.reload()). Each module has its own symbol table, used as the global symbol table for all objects defined in the module. Modules can contain executable statements as well as function definitions."""
"What is a class?, ""A class object serves as a template for creating instances. Classes support inheritance, which is a mechanism of reusing implementations from one or more base classes, allowing you to define a type by terms of another type. A class has a namespace implemented by a dictionary object (this is the dictionary referenced by Class.__dict__). Class instance attributes are found in the dictionary of the instance as well as in the class’s namespace and those of its base classes."""
"What is an instance?, ""A class instance is a concrete occurrence of a class. Each instance has its own namespace implemented as a dictionary, and this is the first place in which attribute references are searched. When an attribute is not found in this dictionary, and the instance’s class has an attribute by that name, the search continues with the class attributes."""
"What is a function?, ""A function object is a callable object created by a function definition. When it is called, it gives access to a separate namespace (the function’s local namespace). Parameter lists are defined in the function definition. An instance method object is a callable object that is the result of accessing a function object (one defined inside a class definition) through an instance of that class. It passes the instance object (that instance that the method was accessed through) as the first argument (usually called self) to the function object. A function object may or may not have a type annotation associated with it."""
"What is a method?, ""A method is a function that is associated with an object. You can call methods on an object using the dot notation (e.g., obj.method()). There are two flavors: built-in methods (such as list.append()) and class instance methods."""
"What is a code object?, ""A code object is a compiled sequence of Python byte code instructions, also called bytecode. Code objects are immutable and contain no references (directly or indirectly) to mutable objects. The executable code for a module is wrapped in a code object. Code objects are represented internally by the PyCodeObject C struct."""
"What are the principal built-in types of Python?, ""The principal built-in types are numerics, sequences, mappings, classes, instances and exceptions."""
"What are the numeric types in Python?, ""Python has the following numeric types: int, float, and complex."""
"What is the int type in Python?, ""These represent integers of unlimited range, subject to available (virtual) memory. Plain integers (also just called integers) are implemented in C using longs. Integer literals are described in the numeric literals section. Integers are immutable numeric types."""
"What is the float type in Python?, ""These represent floating point numbers and are represented internally as double-precision (64 bit) floating point numbers. Usually also known as floats. These are often implemented in C using doubles. Floating point numbers are immutable numeric types."""
"What is the complex type in Python?, ""These represent complex numbers and are represented internally as a pair of double-precision floating point numbers; the real and imaginary part. The real and imaginary parts of a complex number z can be retrieved through the read-only attributes z.real and z.imag. (The library includes the complex numeric type.) Complex numbers are immutable numeric types."""
"What are sequence types in Python?, ""These represent finite ordered index sets indexed by non-negative numbers. The built-in function len() returns the number of items of a sequence. When the length of a sequence is n, the index set contains the numbers 0, 1, ..., n-1. Item i of sequence a is selected by a[i] and slices are defined in sequence types. Sequences are classified according to their mutability; immutable sequence types (strings, tuples, bytes and range objects) and mutable sequence types (lists and bytearrays)."""
"What are the immutable sequence types in Python?, ""An immutable sequence object cannot be changed after it is created. If another object with a different value must be created, it is created with the return value of an operation. In contrast, mutable sequence objects can be changed in place. The following types are immutable sequences: String, Unicode, Tuple, Bytes, Byte Array, Range."""
"What is the string type in Python?, ""Strings are immutable sequences of Unicode code points. There is one string type: str. Strings are sequences of Unicode code points represented as Unicode strings in memory. Unicode code points in the range U+0000—U+10FFFF can be represented in a string. Strings can be written in a variety of ways, including single quotes, double quotes, triple quotes, and escape sequences."""
"What is the tuple type in Python?, ""Tuples are immutable sequences of arbitrary Python objects. Tuples are sequences of arbitrary Python objects. Tuples are written as comma-separated values, optionally enclosed in parentheses. Tuples are immutable, and typically contain a heterogeneous sequence of elements that are accessed via unpacking (see section Assignment statements) or indexing (or even by attribute in the case of named tuples). Lists are mutable, and their elements are usually homogeneous and are accessed by iterating over the list."""
"What is the bytes type in Python?, ""Bytes objects are immutable sequences of single bytes. There are exactly two built-in bytes object types: bytes and bytearray. Bytes objects are immutable sequences of single bytes. Many of the string methods are available for bytes objects as well."""
"What is the byte array type in Python?, ""Byte array objects are a mutable counterpart to bytes objects. There is a dedicated type to handle binary data: the bytes type, and the mutable bytearray type. They are defined in the bytes and bytearray types section."""
"What is the range type in Python?, ""Rather than being a function, range is actually an immutable sequence type dedicated to representing ranges of integers. They are commonly used for looping, but are useful in a number of other contexts. The advantage of range objects is that they always take the same (small) amount of memory, no matter how big the range they represent. Range objects implement all of the common sequence operations except concatenation and repetition (due to the fact that range objects can only represent sequences that follow a strict pattern and repetition will often violate that pattern)."""
"What are the mutable sequence types in Python?, ""Mutable sequences can be changed after they are created. The following types are mutable sequences: List,"""
"What is the byte array type in Python?, ""Byte array objects are a mutable counterpart to bytes objects. There is a dedicated type to handle binary data: the bytes type, and the mutable bytearray type. They are defined in the bytes and bytearray types section."""
"What is the range type in Python?, ""Rather than being a function, range is actually an immutable sequence type dedicated to representing ranges of integers. They are commonly used for looping, but are useful in a number of other contexts. The advantage of range objects is that they always take the same (small) amount of memory, no matter how big the range they represent. Range objects implement all of the common sequence operations except concatenation and repetition (due to the fact that range objects can only represent sequences that follow a strict pattern and repetition will often violate that pattern)."""
"What are the mutable sequence types in Python?, ""Mutable sequences can be changed after they are created. The following types are mutable sequences: List, Byte Array."""
"What is the list type in Python?, ""Lists are mutable sequences, typically used to store collections of homogeneous items (although there are no strict restrictions on the type or mutability of the items). Lists may be constructed in several ways: Using a pair of square brackets to denote the empty list:; Using square brackets, separating items with commas: [a], [a, b, c]; Using a list comprehension: [x for x in iterable]; Using the type constructor: list() or list(iterable)."""
"What are set types in Python?, ""These represent unordered, finite sets of unique, immutable objects. As such, they cannot be indexed by any subscript. However, they can be iterated over, and the built-in function len() returns the number of items in a set."""
"What are the built-in set types in Python?, ""Python provides two built-in set types: sets and frozensets."""
"What is the set type in Python?, ""These represent a mutable set. They are created by the built-in set() constructor and can be modified afterwards by several methods, such as add()."""
"What is the frozenset type in Python?, ""These represent an immutable set. They are created by the built-in frozenset() constructor. As a frozenset is immutable and hashable, it can be used again as an element of another set, or as a dictionary key."""
